conv2d.log
{"input": ["cuda -keys=cuda,gpu -arch=sm_86 -max_num_threads=1024 -thread_warp_size=32", "tutorial/conv2d", [1, 28, 28, 128, 256, 3, 3, [1, 1], [1, 1]], {}], "config": {"index": 11038999, "code_hash": null, "entity": [["tile_f", "sp", [-1, 1, 8, 4]], ["tile_y", "sp", [-1, 2, 1, 7]], ["tile_x", "sp", [-1, 2, 1, 2]], ["tile_rc", "sp", [-1, 8, 2]], ["tile_ry", "sp", [-1, 3, 1]], ["tile_rx", "sp", [-1, 1, 1]], ["auto_unroll_max_step", "ot", 0], ["unroll_explicit", "ot", 0]]}, "result": [[0.0016597482391304348], 0, 2.067913293838501, 1700584543.430984], "version": 0.2, "tvm_version": "0.15.dev0"}
{"input": ["cuda -keys=cuda,gpu -arch=sm_86 -max_num_threads=1024 -thread_warp_size=32", "tutorial/conv2d", [1, 28, 28, 128, 256, 3, 3, [1, 1], [1, 1]], {}], "config": {"index": 153818203, "code_hash": null, "entity": [["tile_f", "sp", [-1, 1, 2, 2]], ["tile_y", "sp", [-1, 1, 1, 2]], ["tile_x", "sp", [-1, 28, 1, 1]], ["tile_rc", "sp", [-1, 2, 32]], ["tile_ry", "sp", [-1, 1, 3]], ["tile_rx", "sp", [-1, 1, 3]], ["auto_unroll_max_step", "ot", 512], ["unroll_explicit", "ot", 0]]}, "result": [[0.014598989142857144], 0, 3.054255247116089, 1700584544.19514], "version": 0.2, "tvm_version": "0.15.dev0"}
{"input": ["cuda -keys=cuda,gpu -arch=sm_86 -max_num_threads=1024 -thread_warp_size=32", "tutorial/conv2d", [1, 28, 28, 128, 256, 3, 3, [1, 1], [1, 1]], {}], "config": {"index": 364990365, "code_hash": null, "entity": [["tile_f", "sp", [-1, 4, 2, 2]], ["tile_y", "sp", [-1, 1, 14, 2]], ["tile_x", "sp", [-1, 1, 1, 28]], ["tile_rc", "sp", [-1, 2, 2]], ["tile_ry", "sp", [-1, 1, 1]], ["tile_rx", "sp", [-1, 1, 3]], ["auto_unroll_max_step", "ot", 512], ["unroll_explicit", "ot", 1]]}, "result": [[0.011846210416666668], 0, 6.5470969676971436, 1700584574.495498], "version": 0.2, "tvm_version": "0.15.dev0"}
{"input": ["cuda -keys=cuda,gpu -arch=sm_86 -max_num_threads=1024 -thread_warp_size=32", "tutorial/conv2d", [1, 28, 28, 128, 256, 3, 3, [1, 1], [1, 1]], {}], "config": {"index": 326565370, "code_hash": null, "entity": [["tile_f", "sp", [-1, 4, 2, 1]], ["tile_y", "sp", [-1, 1, 1, 2]], ["tile_x", "sp", [-1, 2, 2, 7]], ["tile_rc", "sp", [-1, 1, 32]], ["tile_ry", "sp", [-1, 3, 1]], ["tile_rx", "sp", [-1, 1, 1]], ["auto_unroll_max_step", "ot", 512], ["unroll_explicit", "ot", 1]]}, "result": [[0.00316416], 0, 5.879752159118652, 1700584576.902603], "version": 0.2, "tvm_version": "0.15.dev0"}
{"input": ["cuda -keys=cuda,gpu -arch=sm_86 -max_num_threads=1024 -thread_warp_size=32", "tutorial/conv2d", [1, 28, 28, 128, 256, 3, 3, [1, 1], [1, 1]], {}], "config": {"index": 36491608, "code_hash": null, "entity": [["tile_f", "sp", [-1, 8, 1, 8]], ["tile_y", "sp", [-1, 2, 14, 1]], ["tile_x", "sp", [-1, 4, 1, 1]], ["tile_rc", "sp", [-1, 2, 2]], ["tile_ry", "sp", [-1, 3, 1]], ["tile_rx", "sp", [-1, 3, 1]], ["auto_unroll_max_step", "ot", 0], ["unroll_explicit", "ot", 0]]}, "result": [[0.024040448500000002], 0, 3.3289854526519775, 1700584579.1934066], "version": 0.2, "tvm_version": "0.15.dev0"}
{"input": ["cuda -keys=cuda,gpu -arch=sm_86 -max_num_threads=1024 -thread_warp_size=32", "tutorial/conv2d", [1, 28, 28, 128, 256, 3, 3, [1, 1], [1, 1]], {}], "config": {"index": 304370391, "code_hash": null, "entity": [["tile_f", "sp", [-1, 2, 1, 32]], ["tile_y", "sp", [-1, 2, 1, 2]], ["tile_x", "sp", [-1, 1, 4, 1]], ["tile_rc", "sp", [-1, 2, 2]], ["tile_ry", "sp", [-1, 1, 3]], ["tile_rx", "sp", [-1, 1, 3]], ["auto_unroll_max_step", "ot", 0], ["unroll_explicit", "ot", 1]]}, "result": [[0.011848248777777777], 0, 2.468914270401001, 1700584580.8432937], "version": 0.2, "tvm_version": "0.15.dev0"}
{"input": ["cuda -keys=cuda,gpu -arch=sm_86 -max_num_threads=1024 -thread_warp_size=32", "tutorial/conv2d", [1, 28, 28, 128, 256, 3, 3, [1, 1], [1, 1]], {}], "config": {"index": 435338544, "code_hash": null, "entity": [["tile_f", "sp", [-1, 8, 8, 1]], ["tile_y", "sp", [-1, 14, 1, 2]], ["tile_x", "sp", [-1, 1, 14, 1]], ["tile_rc", "sp", [-1, 1, 4]], ["tile_ry", "sp", [-1, 1, 3]], ["tile_rx", "sp", [-1, 3, 1]], ["auto_unroll_max_step", "ot", 1500], ["unroll_explicit", "ot", 1]]}, "result": [[0.0024095208095238096], 0, 4.981333494186401, 1700584585.285799], "version": 0.2, "tvm_version": "0.15.dev0"}
{"input": ["cuda -keys=cuda,gpu -arch=sm_86 -max_num_threads=1024 -thread_warp_size=32", "tutorial/conv2d", [1, 28, 28, 128, 256, 3, 3, [1, 1], [1, 1]], {}], "config": {"index": 167697475, "code_hash": null, "entity": [["tile_f", "sp", [-1, 1, 4, 32]], ["tile_y", "sp", [-1, 1, 2, 14]], ["tile_x", "sp", [-1, 2, 14, 1]], ["tile_rc", "sp", [-1, 2, 4]], ["tile_ry", "sp", [-1, 3, 1]], ["tile_rx", "sp", [-1, 1, 1]], ["auto_unroll_max_step", "ot", 1500], ["unroll_explicit", "ot", 0]]}, "result": [[0.03444275275], 0, 4.84002161026001, 1700584586.2486455], "version": 0.2, "tvm_version": "0.15.dev0"}
{"input": ["cuda -keys=cuda,gpu -arch=sm_86 -max_num_threads=1024 -thread_warp_size=32", "tutorial/conv2d", [1, 28, 28, 128, 256, 3, 3, [1, 1], [1, 1]], {}], "config": {"index": 246696529, "code_hash": null, "entity": [["tile_f", "sp", [-1, 1, 4, 2]], ["tile_y", "sp", [-1, 14, 1, 1]], ["tile_x", "sp", [-1, 1, 4, 7]], ["tile_rc", "sp", [-1, 1, 8]], ["tile_ry", "sp", [-1, 3, 1]], ["tile_rx", "sp", [-1, 1, 1]], ["auto_unroll_max_step", "ot", 0], ["unroll_explicit", "ot", 1]]}, "result": [[0.00402903044], 0, 2.5411109924316406, 1700584587.304232], "version": 0.2, "tvm_version": "0.15.dev0"}
{"input": ["cuda -keys=cuda,gpu -arch=sm_86 -max_num_threads=1024 -thread_warp_size=32", "tutorial/conv2d", [1, 28, 28, 128, 256, 3, 3, [1, 1], [1, 1]], {}], "config": {"index": 130300635, "code_hash": null, "entity": [["tile_f", "sp", [-1, 1, 4, 4]], ["tile_y", "sp", [-1, 1, 2, 14]], ["tile_x", "sp", [-1, 2, 7, 2]], ["tile_rc", "sp", [-1, 8, 1]], ["tile_ry", "sp", [-1, 1, 1]], ["tile_rx", "sp", [-1, 1, 3]], ["auto_unroll_max_step", "ot", 512], ["unroll_explicit", "ot", 0]]}, "result": [[0.0013335441322314047], 0, 2.8549695014953613, 1700584589.1028302], "version": 0.2, "tvm_version": "0.15.dev0"}
{"input": ["cuda -keys=cuda,gpu -arch=sm_86 -max_num_threads=1024 -thread_warp_size=32", "tutorial/conv2d", [1, 28, 28, 128, 256, 3, 3, [1, 1], [1, 1]], {}], "config": {"index": 395741581, "code_hash": null, "entity": [["tile_f", "sp", [-1, 1, 32, 2]], ["tile_y", "sp", [-1, 1, 2, 1]], ["tile_x", "sp", [-1, 1, 2, 1]], ["tile_rc", "sp", [-1, 2, 32]], ["tile_ry", "sp", [-1, 1, 1]], ["tile_rx", "sp", [-1, 1, 1]], ["auto_unroll_max_step", "ot", 1500], ["unroll_explicit", "ot", 1]]}, "result": [[0.001018466292929293], 0, 2.651477575302124, 1700584590.6458585], "version": 0.2, "tvm_version": "0.15.dev0"}
{"input": ["cuda -keys=cuda,gpu -arch=sm_86 -max_num_threads=1024 -thread_warp_size=32", "tutorial/conv2d", [1, 28, 28, 128, 256, 3, 3, [1, 1], [1, 1]], {}], "config": {"index": 211240717, "code_hash": null, "entity": [["tile_f", "sp", [-1, 2, 1, 2]], ["tile_y", "sp", [-1, 2, 1, 2]], ["tile_x", "sp", [-1, 7, 2, 1]], ["tile_rc", "sp", [-1, 8, 4]], ["tile_ry", "sp", [-1, 1, 1]], ["tile_rx", "sp", [-1, 1, 3]], ["auto_unroll_max_step", "ot", 1500], ["unroll_explicit", "ot", 0]]}, "result": [[0.0034840289999999996], 0, 2.929588556289673, 1700584595.932002], "version": 0.2, "tvm_version": "0.15.dev0"}
{"input": ["cuda -keys=cuda,gpu -arch=sm_86 -max_num_threads=1024 -thread_warp_size=32", "tutorial/conv2d", [1, 28, 28, 128, 256, 3, 3, [1, 1], [1, 1]], {}], "config": {"index": 149214738, "code_hash": null, "entity": [["tile_f", "sp", [-1, 8, 4, 1]], ["tile_y", "sp", [-1, 2, 14, 1]], ["tile_x", "sp", [-1, 1, 2, 1]], ["tile_rc", "sp", [-1, 8, 2]], ["tile_ry", "sp", [-1, 1, 3]], ["tile_rx", "sp", [-1, 1, 3]], ["auto_unroll_max_step", "ot", 512], ["unroll_explicit", "ot", 0]]}, "result": [[0.0001494898130563798], 0, 2.522228479385376, 1700584602.9720747], "version": 0.2, "tvm_version": "0.15.dev0"}
{"input": ["cuda -keys=cuda,gpu -arch=sm_86 -max_num_threads=1024 -thread_warp_size=32", "tutorial/conv2d", [1, 28, 28, 128, 256, 3, 3, [1, 1], [1, 1]], {}], "config": {"index": 240423227, "code_hash": null, "entity": [["tile_f", "sp", [-1, 1, 4, 16]], ["tile_y", "sp", [-1, 1, 2, 1]], ["tile_x", "sp", [-1, 7, 2, 1]], ["tile_rc", "sp", [-1, 4, 32]], ["tile_ry", "sp", [-1, 1, 1]], ["tile_rx", "sp", [-1, 1, 1]], ["auto_unroll_max_step", "ot", 0], ["unroll_explicit", "ot", 1]]}, "result": [[0.0015822258350515464], 0, 2.157179832458496, 1700584606.555346], "version": 0.2, "tvm_version": "0.15.dev0"}
{"input": ["cuda -keys=cuda,gpu -arch=sm_86 -max_num_threads=1024 -thread_warp_size=32", "tutorial/conv2d", [1, 28, 28, 128, 256, 3, 3, [1, 1], [1, 1]], {}], "config": {"index": 287676876, "code_hash": null, "entity": [["tile_f", "sp", [-1, 1, 1, 2]], ["tile_y", "sp", [-1, 1, 1, 4]], ["tile_x", "sp", [-1, 1, 7, 1]], ["tile_rc", "sp", [-1, 16, 2]], ["tile_ry", "sp", [-1, 1, 1]], ["tile_rx", "sp", [-1, 1, 3]], ["auto_unroll_max_step", "ot", 0], ["unroll_explicit", "ot", 1]]}, "result": [[0.002283634181818182], 0, 1.7673568725585938, 1700584607.261781], "version": 0.2, "tvm_version": "0.15.dev0"}
{"input": ["cuda -keys=cuda,gpu -arch=sm_86 -max_num_threads=1024 -thread_warp_size=32", "tutorial/conv2d", [1, 28, 28, 128, 256, 3, 3, [1, 1], [1, 1]], {}], "config": {"index": 331753827, "code_hash": null, "entity": [["tile_f", "sp", [-1, 2, 16, 1]], ["tile_y", "sp", [-1, 1, 14, 1]], ["tile_x", "sp", [-1, 1, 4, 7]], ["tile_rc", "sp", [-1, 1, 4]], ["tile_ry", "sp", [-1, 1, 3]], ["tile_rx", "sp", [-1, 1, 1]], ["auto_unroll_max_step", "ot", 512], ["unroll_explicit", "ot", 1]]}, "result": [[0.0003762865140186916], 0, 1.9668023586273193, 1700584609.0824974], "version": 0.2, "tvm_version": "0.15.dev0"}
{"input": ["cuda -keys=cuda,gpu -arch=sm_86 -max_num_threads=1024 -thread_warp_size=32", "tutorial/conv2d", [1, 28, 28, 128, 256, 3, 3, [1, 1], [1, 1]], {}], "config": {"index": 350322156, "code_hash": null, "entity": [["tile_f", "sp", [-1, 1, 1, 2]], ["tile_y", "sp", [-1, 2, 1, 7]], ["tile_x", "sp", [-1, 7, 2, 2]], ["tile_rc", "sp", [-1, 1, 8]], ["tile_ry", "sp", [-1, 3, 1]], ["tile_rx", "sp", [-1, 3, 1]], ["auto_unroll_max_step", "ot", 512], ["unroll_explicit", "ot", 1]]}, "result": [[0.0381724165], 0, 5.095463514328003, 1700584612.6559927], "version": 0.2, "tvm_version": "0.15.dev0"}
{"input": ["cuda -keys=cuda,gpu -arch=sm_86 -max_num_threads=1024 -thread_warp_size=32", "tutorial/conv2d", [1, 28, 28, 128, 256, 3, 3, [1, 1], [1, 1]], {}], "config": {"index": 3856821, "code_hash": null, "entity": [["tile_f", "sp", [-1, 1, 8, 1]], ["tile_y", "sp", [-1, 7, 1, 2]], ["tile_x", "sp", [-1, 7, 1, 1]], ["tile_rc", "sp", [-1, 8, 4]], ["tile_ry", "sp", [-1, 1, 1]], ["tile_rx", "sp", [-1, 1, 1]], ["auto_unroll_max_step", "ot", 0], ["unroll_explicit", "ot", 0]]}, "result": [[0.00348231434883721], 0, 3.1660141944885254, 1700584618.1807957], "version": 0.2, "tvm_version": "0.15.dev0"}
{"input": ["cuda -keys=cuda,gpu -arch=sm_86 -max_num_threads=1024 -thread_warp_size=32", "tutorial/conv2d", [1, 28, 28, 128, 256, 3, 3, [1, 1], [1, 1]], {}], "config": {"index": 354458038, "code_hash": null, "entity": [["tile_f", "sp", [-1, 1, 2, 64]], ["tile_y", "sp", [-1, 2, 14, 1]], ["tile_x", "sp", [-1, 28, 1, 1]], ["tile_rc", "sp", [-1, 2, 1]], ["tile_ry", "sp", [-1, 1, 3]], ["tile_rx", "sp", [-1, 3, 1]], ["auto_unroll_max_step", "ot", 512], ["unroll_explicit", "ot", 1]]}, "result": [[0.09593087], 0, 4.925677061080933, 1700584621.7291572], "version": 0.2, "tvm_version": "0.15.dev0"}
{"input": ["cuda -keys=cuda,gpu -arch=sm_86 -max_num_threads=1024 -thread_warp_size=32", "tutorial/conv2d", [1, 28, 28, 128, 256, 3, 3, [1, 1], [1, 1]], {}], "config": {"index": 81141723, "code_hash": null, "entity": [["tile_f", "sp", [-1, 8, 1, 1]], ["tile_y", "sp", [-1, 14, 1, 2]], ["tile_x", "sp", [-1, 1, 7, 2]], ["tile_rc", "sp", [-1, 1, 4]], ["tile_ry", "sp", [-1, 1, 1]], ["tile_rx", "sp", [-1, 1, 1]], ["auto_unroll_max_step", "ot", 512], ["unroll_explicit", "ot", 0]]}, "result": [[0.017798144], 0, 4.1183202266693115, 1700584623.6698854], "version": 0.2, "tvm_version": "0.15.dev0"}
{"input": ["cuda -keys=cuda,gpu -arch=sm_86 -max_num_threads=1024 -thread_warp_size=32", "tutorial/conv2d", [1, 28, 28, 128, 256, 3, 3, [1, 1], [1, 1]], {}], "config": {"index": 302406132, "code_hash": null, "entity": [["tile_f", "sp", [-1, 16, 2, 1]], ["tile_y", "sp", [-1, 7, 4, 1]], ["tile_x", "sp", [-1, 2, 1, 1]], ["tile_rc", "sp", [-1, 1, 1]], ["tile_ry", "sp", [-1, 1, 3]], ["tile_rx", "sp", [-1, 1, 3]], ["auto_unroll_max_step", "ot", 0], ["unroll_explicit", "ot", 1]]}, "result": [[0.0011659373435114505], 0, 2.453688621520996, 1700584778.546101], "version": 0.2, "tvm_version": "0.15.dev0"}
{"input": ["cuda -keys=cuda,gpu -arch=sm_86 -max_num_threads=1024 -thread_warp_size=32", "tutorial/conv2d", [1, 28, 28, 128, 256, 3, 3, [1, 1], [1, 1]], {}], "config": {"index": 69130932, "code_hash": null, "entity": [["tile_f", "sp", [-1, 16, 2, 1]], ["tile_y", "sp", [-1, 7, 4, 1]], ["tile_x", "sp", [-1, 4, 1, 1]], ["tile_rc", "sp", [-1, 1, 1]], ["tile_ry", "sp", [-1, 1, 3]], ["tile_rx", "sp", [-1, 1, 3]], ["auto_unroll_max_step", "ot", 0], ["unroll_explicit", "ot", 0]]}, "result": [[0.012871680250000002], 0, 2.96001935005188, 1700584780.7853177], "version": 0.2, "tvm_version": "0.15.dev0"}
{"input": ["cuda -keys=cuda,gpu -arch=sm_86 -max_num_threads=1024 -thread_warp_size=32", "tutorial/conv2d", [1, 28, 28, 128, 256, 3, 3, [1, 1], [1, 1]], {}], "config": {"index": 380353338, "code_hash": null, "entity": [["tile_f", "sp", [-1, 8, 4, 1]], ["tile_y", "sp", [-1, 7, 4, 1]], ["tile_x", "sp", [-1, 1, 1, 1]], ["tile_rc", "sp", [-1, 2, 1]], ["tile_ry", "sp", [-1, 1, 3]], ["tile_rx", "sp", [-1, 1, 3]], ["auto_unroll_max_step", "ot", 512], ["unroll_explicit", "ot", 1]]}, "result": [[0.00022986305444126076], 0, 2.4430956840515137, 1700584781.7633247], "version": 0.2, "tvm_version": "0.15.dev0"}
{"input": ["cuda -keys=cuda,gpu -arch=sm_86 -max_num_threads=1024 -thread_warp_size=32", "tutorial/conv2d", [1, 28, 28, 128, 256, 3, 3, [1, 1], [1, 1]], {}], "config": {"index": 147102138, "code_hash": null, "entity": [["tile_f", "sp", [-1, 8, 4, 1]], ["tile_y", "sp", [-1, 7, 4, 1]], ["tile_x", "sp", [-1, 1, 2, 1]], ["tile_rc", "sp", [-1, 2, 1]], ["tile_ry", "sp", [-1, 1, 3]], ["tile_rx", "sp", [-1, 1, 3]], ["auto_unroll_max_step", "ot", 512], ["unroll_explicit", "ot", 0]]}, "result": [[0.0003974658596059113], 0, 2.180476427078247, 1700584783.7789307], "version": 0.2, "tvm_version": "0.15.dev0"}
{"input": ["cuda -keys=cuda,gpu -arch=sm_86 -max_num_threads=1024 -thread_warp_size=32", "tutorial/conv2d", [1, 28, 28, 128, 256, 3, 3, [1, 1], [1, 1]], {}], "config": {"index": 380382138, "code_hash": null, "entity": [["tile_f", "sp", [-1, 8, 4, 1]], ["tile_y", "sp", [-1, 7, 4, 1]], ["tile_x", "sp", [-1, 1, 2, 1]], ["tile_rc", "sp", [-1, 2, 1]], ["tile_ry", "sp", [-1, 1, 3]], ["tile_rx", "sp", [-1, 1, 3]], ["auto_unroll_max_step", "ot", 512], ["unroll_explicit", "ot", 1]]}, "result": [[0.0002379163920118343], 0, 2.6190218925476074, 1700584784.7609174], "version": 0.2, "tvm_version": "0.15.dev0"}
{"input": ["cuda -keys=cuda,gpu -arch=sm_86 -max_num_threads=1024 -thread_warp_size=32", "tutorial/conv2d", [1, 28, 28, 128, 256, 3, 3, [1, 1], [1, 1]], {}], "config": {"index": 305862852, "code_hash": null, "entity": [["tile_f", "sp", [-1, 16, 2, 1]], ["tile_y", "sp", [-1, 1, 28, 1]], ["tile_x", "sp", [-1, 2, 1, 1]], ["tile_rc", "sp", [-1, 2, 4]], ["tile_ry", "sp", [-1, 1, 3]], ["tile_rx", "sp", [-1, 1, 3]], ["auto_unroll_max_step", "ot", 0], ["unroll_explicit", "ot", 1]]}, "result": [[0.0018025691071428573], 0, 2.107372760772705, 1700584785.4673817], "version": 0.2, "tvm_version": "0.15.dev0"}
{"input": ["cuda -keys=cuda,gpu -arch=sm_86 -max_num_threads=1024 -thread_warp_size=32", "tutorial/conv2d", [1, 28, 28, 128, 256, 3, 3, [1, 1], [1, 1]], {}], "config": {"index": 302410932, "code_hash": null, "entity": [["tile_f", "sp", [-1, 16, 2, 1]], ["tile_y", "sp", [-1, 7, 4, 1]], ["tile_x", "sp", [-1, 4, 1, 1]], ["tile_rc", "sp", [-1, 1, 1]], ["tile_ry", "sp", [-1, 1, 3]], ["tile_rx", "sp", [-1, 1, 3]], ["auto_unroll_max_step", "ot", 0], ["unroll_explicit", "ot", 1]]}, "result": [[0.012909952125], 0, 2.6412203311920166, 1700584787.176867], "version": 0.2, "tvm_version": "0.15.dev0"}
{"input": ["cuda -keys=cuda,gpu -arch=sm_86 -max_num_threads=1024 -thread_warp_size=32", "tutorial/conv2d", [1, 28, 28, 128, 256, 3, 3, [1, 1], [1, 1]], {}], "config": {"index": 69342138, "code_hash": null, "entity": [["tile_f", "sp", [-1, 8, 4, 1]], ["tile_y", "sp", [-1, 7, 4, 1]], ["tile_x", "sp", [-1, 1, 2, 1]], ["tile_rc", "sp", [-1, 2, 1]], ["tile_ry", "sp", [-1, 1, 3]], ["tile_rx", "sp", [-1, 1, 3]], ["auto_unroll_max_step", "ot", 0], ["unroll_explicit", "ot", 0]]}, "result": [[0.00040047314179104477], 0, 2.034111261367798, 1700584788.1825662], "version": 0.2, "tvm_version": "0.15.dev0"}
{"input": ["cuda -keys=cuda,gpu -arch=sm_86 -max_num_threads=1024 -thread_warp_size=32", "tutorial/conv2d", [1, 28, 28, 128, 256, 3, 3, [1, 1], [1, 1]], {}], "config": {"index": 302622138, "code_hash": null, "entity": [["tile_f", "sp", [-1, 8, 4, 1]], ["tile_y", "sp", [-1, 7, 4, 1]], ["tile_x", "sp", [-1, 1, 2, 1]], ["tile_rc", "sp", [-1, 2, 1]], ["tile_ry", "sp", [-1, 1, 3]], ["tile_rx", "sp", [-1, 1, 3]], ["auto_unroll_max_step", "ot", 0], ["unroll_explicit", "ot", 1]]}, "result": [[0.0004004705995024876], 0, 2.0395073890686035, 1700584790.0734384], "version": 0.2, "tvm_version": "0.15.dev0"}
{"input": ["cuda -keys=cuda,gpu -arch=sm_86 -max_num_threads=1024 -thread_warp_size=32", "tutorial/conv2d", [1, 28, 28, 128, 256, 3, 3, [1, 1], [1, 1]], {}], "config": {"index": 146886132, "code_hash": null, "entity": [["tile_f", "sp", [-1, 16, 2, 1]], ["tile_y", "sp", [-1, 7, 4, 1]], ["tile_x", "sp", [-1, 2, 1, 1]], ["tile_rc", "sp", [-1, 1, 1]], ["tile_ry", "sp", [-1, 1, 3]], ["tile_rx", "sp", [-1, 1, 3]], ["auto_unroll_max_step", "ot", 512], ["unroll_explicit", "ot", 0]]}, "result": [[0.0012062103012048192], 0, 2.0089290142059326, 1700584790.777753], "version": 0.2, "tvm_version": "0.15.dev0"}
{"input": ["cuda -keys=cuda,gpu -arch=sm_86 -max_num_threads=1024 -thread_warp_size=32", "tutorial/conv2d", [1, 28, 28, 128, 256, 3, 3, [1, 1], [1, 1]], {}], "config": {"index": 147073338, "code_hash": null, "entity": [["tile_f", "sp", [-1, 8, 4, 1]], ["tile_y", "sp", [-1, 7, 4, 1]], ["tile_x", "sp", [-1, 1, 1, 1]], ["tile_rc", "sp", [-1, 2, 1]], ["tile_ry", "sp", [-1, 1, 3]], ["tile_rx", "sp", [-1, 1, 3]], ["auto_unroll_max_step", "ot", 512], ["unroll_explicit", "ot", 0]]}, "result": [[0.00038389213095238093], 0, 1.948395013809204, 1700584791.7526884], "version": 0.2, "tvm_version": "0.15.dev0"}
{"input": ["cuda -keys=cuda,gpu -arch=sm_86 -max_num_threads=1024 -thread_warp_size=32", "tutorial/conv2d", [1, 28, 28, 128, 256, 3, 3, [1, 1], [1, 1]], {}], "config": {"index": 225222743, "code_hash": null, "entity": [["tile_f", "sp", [-1, 4, 8, 1]], ["tile_y", "sp", [-1, 2, 14, 1]], ["tile_x", "sp", [-1, 2, 1, 1]], ["tile_rc", "sp", [-1, 8, 1]], ["tile_ry", "sp", [-1, 1, 3]], ["tile_rx", "sp", [-1, 1, 3]], ["auto_unroll_max_step", "ot", 1500], ["unroll_explicit", "ot", 0]]}, "result": [[0.0001591497142857143], 0, 1.67629075050354, 1700584793.59834], "version": 0.2, "tvm_version": "0.15.dev0"}
{"input": ["cuda -keys=cuda,gpu -arch=sm_86 -max_num_threads=1024 -thread_warp_size=32", "tutorial/conv2d", [1, 28, 28, 128, 256, 3, 3, [1, 1], [1, 1]], {}], "config": {"index": 69702743, "code_hash": null, "entity": [["tile_f", "sp", [-1, 4, 8, 1]], ["tile_y", "sp", [-1, 2, 14, 1]], ["tile_x", "sp", [-1, 2, 1, 1]], ["tile_rc", "sp", [-1, 8, 1]], ["tile_ry", "sp", [-1, 1, 3]], ["tile_rx", "sp", [-1, 1, 3]], ["auto_unroll_max_step", "ot", 0], ["unroll_explicit", "ot", 0]]}, "result": [[0.00021006054771241826], 0, 1.9417541027069092, 1700584794.9011357], "version": 0.2, "tvm_version": "0.15.dev0"}
{"input": ["cuda -keys=cuda,gpu -arch=sm_86 -max_num_threads=1024 -thread_warp_size=32", "tutorial/conv2d", [1, 28, 28, 128, 256, 3, 3, [1, 1], [1, 1]], {}], "config": {"index": 380738070, "code_hash": null, "entity": [["tile_f", "sp", [-1, 1, 32, 1]], ["tile_y", "sp", [-1, 1, 28, 1]], ["tile_x", "sp", [-1, 1, 1, 1]], ["tile_rc", "sp", [-1, 8, 1]], ["tile_ry", "sp", [-1, 1, 3]], ["tile_rx", "sp", [-1, 1, 3]], ["auto_unroll_max_step", "ot", 512], ["unroll_explicit", "ot", 1]]}, "result": [[0.00021019165359477125], 0, 1.4963254928588867, 1700584795.878541], "version": 0.2, "tvm_version": "0.15.dev0"}
{"input": ["cuda -keys=cuda,gpu -arch=sm_86 -max_num_threads=1024 -thread_warp_size=32", "tutorial/conv2d", [1, 28, 28, 128, 256, 3, 3, [1, 1], [1, 1]], {}], "config": {"index": 303169350, "code_hash": null, "entity": [["tile_f", "sp", [-1, 1, 32, 1]], ["tile_y", "sp", [-1, 7, 4, 1]], ["tile_x", "sp", [-1, 1, 1, 1]], ["tile_rc", "sp", [-1, 16, 1]], ["tile_ry", "sp", [-1, 1, 3]], ["tile_rx", "sp", [-1, 1, 3]], ["auto_unroll_max_step", "ot", 0], ["unroll_explicit", "ot", 1]]}, "result": [[0.0002251210237762238], 0, 1.5812349319458008, 1700584797.7599816], "version": 0.2, "tvm_version": "0.15.dev0"}
{"input": ["cuda -keys=cuda,gpu -arch=sm_86 -max_num_threads=1024 -thread_warp_size=32", "tutorial/conv2d", [1, 28, 28, 128, 256, 3, 3, [1, 1], [1, 1]], {}], "config": {"index": 225218070, "code_hash": null, "entity": [["tile_f", "sp", [-1, 1, 32, 1]], ["tile_y", "sp", [-1, 1, 28, 1]], ["tile_x", "sp", [-1, 1, 1, 1]], ["tile_rc", "sp", [-1, 8, 1]], ["tile_ry", "sp", [-1, 1, 3]], ["tile_rx", "sp", [-1, 1, 3]], ["auto_unroll_max_step", "ot", 1500], ["unroll_explicit", "ot", 0]]}, "result": [[0.00021017298431372548], 0, 1.587188482284546, 1700584798.7326438], "version": 0.2, "tvm_version": "0.15.dev0"}
{"input": ["cuda -keys=cuda,gpu -arch=sm_86 -max_num_threads=1024 -thread_warp_size=32", "tutorial/conv2d", [1, 28, 28, 128, 256, 3, 3, [1, 1], [1, 1]], {}], "config": {"index": 302978070, "code_hash": null, "entity": [["tile_f", "sp", [-1, 1, 32, 1]], ["tile_y", "sp", [-1, 1, 28, 1]], ["tile_x", "sp", [-1, 1, 1, 1]], ["tile_rc", "sp", [-1, 8, 1]], ["tile_ry", "sp", [-1, 1, 3]], ["tile_rx", "sp", [-1, 1, 3]], ["auto_unroll_max_step", "ot", 0], ["unroll_explicit", "ot", 1]]}, "result": [[0.0002110427947712418], 0, 1.4405040740966797, 1700584799.708527], "version": 0.2, "tvm_version": "0.15.dev0"}
{"input": ["cuda -keys=cuda,gpu -arch=sm_86 -max_num_threads=1024 -thread_warp_size=32", "tutorial/conv2d", [1, 28, 28, 128, 256, 3, 3, [1, 1], [1, 1]], {}], "config": {"index": 458498070, "code_hash": null, "entity": [["tile_f", "sp", [-1, 1, 32, 1]], ["tile_y", "sp", [-1, 1, 28, 1]], ["tile_x", "sp", [-1, 1, 1, 1]], ["tile_rc", "sp", [-1, 8, 1]], ["tile_ry", "sp", [-1, 1, 3]], ["tile_rx", "sp", [-1, 1, 3]], ["auto_unroll_max_step", "ot", 1500], ["unroll_explicit", "ot", 1]]}, "result": [[0.00021171807255936678], 0, 1.8280551433563232, 1700584801.9346228], "version": 0.2, "tvm_version": "0.15.dev0"}
{"input": ["cuda -keys=cuda,gpu -arch=sm_86 -max_num_threads=1024 -thread_warp_size=32", "tutorial/conv2d", [1, 28, 28, 128, 256, 3, 3, [1, 1], [1, 1]], {}], "config": {"index": 226566743, "code_hash": null, "entity": [["tile_f", "sp", [-1, 4, 8, 1]], ["tile_y", "sp", [-1, 2, 14, 1]], ["tile_x", "sp", [-1, 2, 1, 1]], ["tile_rc", "sp", [-1, 2, 2]], ["tile_ry", "sp", [-1, 1, 3]], ["tile_rx", "sp", [-1, 1, 3]], ["auto_unroll_max_step", "ot", 1500], ["unroll_explicit", "ot", 0]]}, "result": [[0.00010078339798488665], 0, 1.9779419898986816, 1700584802.9102325], "version": 0.2, "tvm_version": "0.15.dev0"}
{"input": ["cuda -keys=cuda,gpu -arch=sm_86 -max_num_threads=1024 -thread_warp_size=32", "tutorial/conv2d", [1, 28, 28, 128, 256, 3, 3, [1, 1], [1, 1]], {}], "config": {"index": 147106938, "code_hash": null, "entity": [["tile_f", "sp", [-1, 8, 4, 1]], ["tile_y", "sp", [-1, 7, 4, 1]], ["tile_x", "sp", [-1, 2, 2, 1]], ["tile_rc", "sp", [-1, 2, 1]], ["tile_ry", "sp", [-1, 1, 3]], ["tile_rx", "sp", [-1, 1, 3]], ["auto_unroll_max_step", "ot", 512], ["unroll_explicit", "ot", 0]]}, "result": [[0.000889674761061947], 0, 2.2091660499572754, 1700584804.4941783], "version": 0.2, "tvm_version": "0.15.dev0"}
{"input": ["cuda -keys=cuda,gpu -arch=sm_86 -max_num_threads=1024 -thread_warp_size=32", "tutorial/conv2d", [1, 28, 28, 128, 256, 3, 3, [1, 1], [1, 1]], {}], "config": {"index": 458339658, "code_hash": null, "entity": [["tile_f", "sp", [-1, 8, 4, 1]], ["tile_y", "sp", [-1, 1, 28, 1]], ["tile_x", "sp", [-1, 2, 2, 1]], ["tile_rc", "sp", [-1, 4, 1]], ["tile_ry", "sp", [-1, 1, 3]], ["tile_rx", "sp", [-1, 1, 3]], ["auto_unroll_max_step", "ot", 1500], ["unroll_explicit", "ot", 1]]}, "result": [[0.00014754540110395586], 0, 2.500701427459717, 1700584805.4764836], "version": 0.2, "tvm_version": "0.15.dev0"}
{"input": ["cuda -keys=cuda,gpu -arch=sm_86 -max_num_threads=1024 -thread_warp_size=32", "tutorial/conv2d", [1, 28, 28, 128, 256, 3, 3, [1, 1], [1, 1]], {}], "config": {"index": 147107658, "code_hash": null, "entity": [["tile_f", "sp", [-1, 8, 4, 1]], ["tile_y", "sp", [-1, 1, 28, 1]], ["tile_x", "sp", [-1, 2, 2, 1]], ["tile_rc", "sp", [-1, 2, 1]], ["tile_ry", "sp", [-1, 1, 3]], ["tile_rx", "sp", [-1, 1, 3]], ["auto_unroll_max_step", "ot", 512], ["unroll_explicit", "ot", 0]]}, "result": [[0.00016086435535535537], 0, 2.0448827743530273, 1700584807.5295577], "version": 0.2, "tvm_version": "0.15.dev0"}
{"input": ["cuda -keys=cuda,gpu -arch=sm_86 -max_num_threads=1024 -thread_warp_size=32", "tutorial/conv2d", [1, 28, 28, 128, 256, 3, 3, [1, 1], [1, 1]], {}], "config": {"index": 149027307, "code_hash": null, "entity": [["tile_f", "sp", [-1, 2, 16, 1]], ["tile_y", "sp", [-1, 4, 7, 1]], ["tile_x", "sp", [-1, 2, 2, 1]], ["tile_rc", "sp", [-1, 4, 2]], ["tile_ry", "sp", [-1, 1, 3]], ["tile_rx", "sp", [-1, 1, 3]], ["auto_unroll_max_step", "ot", 512], ["unroll_explicit", "ot", 0]]}, "result": [[0.0002074226812903226], 0, 2.107053279876709, 1700584808.509957], "version": 0.2, "tvm_version": "0.15.dev0"}
{"input": ["cuda -keys=cuda,gpu -arch=sm_86 -max_num_threads=1024 -thread_warp_size=32", "tutorial/conv2d", [1, 28, 28, 128, 256, 3, 3, [1, 1], [1, 1]], {}], "config": {"index": 227910743, "code_hash": null, "entity": [["tile_f", "sp", [-1, 4, 8, 1]], ["tile_y", "sp", [-1, 2, 14, 1]], ["tile_x", "sp", [-1, 2, 1, 1]], ["tile_rc", "sp", [-1, 1, 4]], ["tile_ry", "sp", [-1, 1, 3]], ["tile_rx", "sp", [-1, 1, 3]], ["auto_unroll_max_step", "ot", 1500], ["unroll_explicit", "ot", 0]]}, "result": [[0.00010078938422712933], 0, 1.8343427181243896, 1700584810.384919], "version": 0.2, "tvm_version": "0.15.dev0"}
{"input": ["cuda -keys=cuda,gpu -arch=sm_86 -max_num_threads=1024 -thread_warp_size=32", "tutorial/conv2d", [1, 28, 28, 128, 256, 3, 3, [1, 1], [1, 1]], {}], "config": {"index": 302626938, "code_hash": null, "entity": [["tile_f", "sp", [-1, 8, 4, 1]], ["tile_y", "sp", [-1, 7, 4, 1]], ["tile_x", "sp", [-1, 2, 2, 1]], ["tile_rc", "sp", [-1, 2, 1]], ["tile_ry", "sp", [-1, 1, 3]], ["tile_rx", "sp", [-1, 1, 3]], ["auto_unroll_max_step", "ot", 0], ["unroll_explicit", "ot", 1]]}, "result": [[0.0008795082280701754], 0, 2.4014384746551514, 1700584811.4243793], "version": 0.2, "tvm_version": "0.15.dev0"}
{"input": ["cuda -keys=cuda,gpu -arch=sm_86 -max_num_threads=1024 -thread_warp_size=32", "tutorial/conv2d", [1, 28, 28, 128, 256, 3, 3, [1, 1], [1, 1]], {}], "config": {"index": 382307307, "code_hash": null, "entity": [["tile_f", "sp", [-1, 2, 16, 1]], ["tile_y", "sp", [-1, 4, 7, 1]], ["tile_x", "sp", [-1, 2, 2, 1]], ["tile_rc", "sp", [-1, 4, 2]], ["tile_ry", "sp", [-1, 1, 3]], ["tile_rx", "sp", [-1, 1, 3]], ["auto_unroll_max_step", "ot", 512], ["unroll_explicit", "ot", 1]]}, "result": [[0.00019619215], 0, 2.5038094520568848, 1700584813.3125415], "version": 0.2, "tvm_version": "0.15.dev0"}
{"input": ["cuda -keys=cuda,gpu -arch=sm_86 -max_num_threads=1024 -thread_warp_size=32", "tutorial/conv2d", [1, 28, 28, 128, 256, 3, 3, [1, 1], [1, 1]], {}], "config": {"index": 148806743, "code_hash": null, "entity": [["tile_f", "sp", [-1, 4, 8, 1]], ["tile_y", "sp", [-1, 2, 14, 1]], ["tile_x", "sp", [-1, 2, 1, 1]], ["tile_rc", "sp", [-1, 2, 2]], ["tile_ry", "sp", [-1, 1, 3]], ["tile_rx", "sp", [-1, 1, 3]], ["auto_unroll_max_step", "ot", 512], ["unroll_explicit", "ot", 0]]}, "result": [[0.00011685989139941691], 0, 1.890861988067627, 1700584815.1890423], "version": 0.2, "tvm_version": "0.15.dev0"}
{"input": ["cuda -keys=cuda,gpu -arch=sm_86 -max_num_threads=1024 -thread_warp_size=32", "tutorial/conv2d", [1, 28, 28, 128, 256, 3, 3, [1, 1], [1, 1]], {}], "config": {"index": 226787307, "code_hash": null, "entity": [["tile_f", "sp", [-1, 2, 16, 1]], ["tile_y", "sp", [-1, 4, 7, 1]], ["tile_x", "sp", [-1, 2, 2, 1]], ["tile_rc", "sp", [-1, 4, 2]], ["tile_ry", "sp", [-1, 1, 3]], ["tile_rx", "sp", [-1, 1, 3]], ["auto_unroll_max_step", "ot", 1500], ["unroll_explicit", "ot", 0]]}, "result": [[0.00020741409536082474], 0, 1.9241044521331787, 1700584816.16588], "version": 0.2, "tvm_version": "0.15.dev0"}
{"input": ["cuda -keys=cuda,gpu -arch=sm_86 -max_num_threads=1024 -thread_warp_size=32", "tutorial/conv2d", [1, 28, 28, 128, 256, 3, 3, [1, 1], [1, 1]], {}], "config": {"index": 71046743, "code_hash": null, "entity": [["tile_f", "sp", [-1, 4, 8, 1]], ["tile_y", "sp", [-1, 2, 14, 1]], ["tile_x", "sp", [-1, 2, 1, 1]], ["tile_rc", "sp", [-1, 2, 2]], ["tile_ry", "sp", [-1, 1, 3]], ["tile_rx", "sp", [-1, 1, 3]], ["auto_unroll_max_step", "ot", 0], ["unroll_explicit", "ot", 0]]}, "result": [[0.00011685859941520467], 0, 1.855182409286499, 1700584818.0285583], "version": 0.2, "tvm_version": "0.15.dev0"}
{"input": ["cuda -keys=cuda,gpu -arch=sm_86 -max_num_threads=1024 -thread_warp_size=32", "tutorial/conv2d", [1, 28, 28, 128, 256, 3, 3, [1, 1], [1, 1]], {}], "config": {"index": 380386938, "code_hash": null, "entity": [["tile_f", "sp", [-1, 8, 4, 1]], ["tile_y", "sp", [-1, 7, 4, 1]], ["tile_x", "sp", [-1, 2, 2, 1]], ["tile_rc", "sp", [-1, 2, 1]], ["tile_ry", "sp", [-1, 1, 3]], ["tile_rx", "sp", [-1, 1, 3]], ["auto_unroll_max_step", "ot", 512], ["unroll_explicit", "ot", 1]]}, "result": [[0.0006364119488188977], 0, 3.240054130554199, 1700584820.1357996], "version": 0.2, "tvm_version": "0.15.dev0"}
{"input": ["cuda -keys=cuda,gpu -arch=sm_86 -max_num_threads=1024 -thread_warp_size=32", "tutorial/conv2d", [1, 28, 28, 128, 256, 3, 3, [1, 1], [1, 1]], {}], "config": {"index": 151523658, "code_hash": null, "entity": [["tile_f", "sp", [-1, 8, 4, 1]], ["tile_y", "sp", [-1, 1, 28, 1]], ["tile_x", "sp", [-1, 2, 2, 1]], ["tile_rc", "sp", [-1, 1, 8]], ["tile_ry", "sp", [-1, 1, 3]], ["tile_rx", "sp", [-1, 1, 3]], ["auto_unroll_max_step", "ot", 512], ["unroll_explicit", "ot", 0]]}, "result": [[0.001816343306818182], 0, 2.4112462997436523, 1700584821.3702672], "version": 0.2, "tvm_version": "0.15.dev0"}
{"input": ["cuda -keys=cuda,gpu -arch=sm_86 -max_num_threads=1024 -thread_warp_size=32", "tutorial/conv2d", [1, 28, 28, 128, 256, 3, 3, [1, 1], [1, 1]], {}], "config": {"index": 380189430, "code_hash": null, "entity": [["tile_f", "sp", [-1, 1, 32, 1]], ["tile_y", "sp", [-1, 28, 1, 1]], ["tile_x", "sp", [-1, 1, 2, 1]], ["tile_rc", "sp", [-1, 1, 1]], ["tile_ry", "sp", [-1, 1, 3]], ["tile_rx", "sp", [-1, 1, 3]], ["auto_unroll_max_step", "ot", 512], ["unroll_explicit", "ot", 1]]}, "result": [[0.00016386402653061224], 0, 1.974491834640503, 1700584823.23178], "version": 0.2, "tvm_version": "0.15.dev0"}
{"input": ["cuda -keys=cuda,gpu -arch=sm_86 -max_num_threads=1024 -thread_warp_size=32", "tutorial/conv2d", [1, 28, 28, 128, 256, 3, 3, [1, 1], [1, 1]], {}], "config": {"index": 461190743, "code_hash": null, "entity": [["tile_f", "sp", [-1, 4, 8, 1]], ["tile_y", "sp", [-1, 2, 14, 1]], ["tile_x", "sp", [-1, 2, 1, 1]], ["tile_rc", "sp", [-1, 1, 4]], ["tile_ry", "sp", [-1, 1, 3]], ["tile_rx", "sp", [-1, 1, 3]], ["auto_unroll_max_step", "ot", 1500], ["unroll_explicit", "ot", 1]]}, "result": [[9.723324922887106e-05], 0, 2.398435115814209, 1700584824.5216305], "version": 0.2, "tvm_version": "0.15.dev0"}
{"input": ["cuda -keys=cuda,gpu -arch=sm_86 -max_num_threads=1024 -thread_warp_size=32", "tutorial/conv2d", [1, 28, 28, 128, 256, 3, 3, [1, 1], [1, 1]], {}], "config": {"index": 382086743, "code_hash": null, "entity": [["tile_f", "sp", [-1, 4, 8, 1]], ["tile_y", "sp", [-1, 2, 14, 1]], ["tile_x", "sp", [-1, 2, 1, 1]], ["tile_rc", "sp", [-1, 2, 2]], ["tile_ry", "sp", [-1, 1, 3]], ["tile_rx", "sp", [-1, 1, 3]], ["auto_unroll_max_step", "ot", 512], ["unroll_explicit", "ot", 1]]}, "result": [[0.00010529908113456465], 0, 2.1049158573150635, 1700584826.40581], "version": 0.2, "tvm_version": "0.15.dev0"}
{"input": ["cuda -keys=cuda,gpu -arch=sm_86 -max_num_threads=1024 -thread_warp_size=32", "tutorial/conv2d", [1, 28, 28, 128, 256, 3, 3, [1, 1], [1, 1]], {}], "config": {"index": 304547307, "code_hash": null, "entity": [["tile_f", "sp", [-1, 2, 16, 1]], ["tile_y", "sp", [-1, 4, 7, 1]], ["tile_x", "sp", [-1, 2, 2, 1]], ["tile_rc", "sp", [-1, 4, 2]], ["tile_ry", "sp", [-1, 1, 3]], ["tile_rx", "sp", [-1, 1, 3]], ["auto_unroll_max_step", "ot", 0], ["unroll_explicit", "ot", 1]]}, "result": [[0.00023892927299703264], 0, 2.06463885307312, 1700584827.3945694], "version": 0.2, "tvm_version": "0.15.dev0"}
{"input": ["cuda -keys=cuda,gpu -arch=sm_86 -max_num_threads=1024 -thread_warp_size=32", "tutorial/conv2d", [1, 28, 28, 128, 256, 3, 3, [1, 1], [1, 1]], {}], "config": {"index": 460067307, "code_hash": null, "entity": [["tile_f", "sp", [-1, 2, 16, 1]], ["tile_y", "sp", [-1, 4, 7, 1]], ["tile_x", "sp", [-1, 2, 2, 1]], ["tile_rc", "sp", [-1, 4, 2]], ["tile_ry", "sp", [-1, 1, 3]], ["tile_rx", "sp", [-1, 1, 3]], ["auto_unroll_max_step", "ot", 1500], ["unroll_explicit", "ot", 1]]}, "result": [[0.00019414693478260868], 0, 2.6076016426086426, 1700584828.5359018], "version": 0.2, "tvm_version": "0.15.dev0"}
{"input": ["cuda -keys=cuda,gpu -arch=sm_86 -max_num_threads=1024 -thread_warp_size=32", "tutorial/conv2d", [1, 28, 28, 128, 256, 3, 3, [1, 1], [1, 1]], {}], "config": {"index": 304321350, "code_hash": null, "entity": [["tile_f", "sp", [-1, 1, 32, 1]], ["tile_y", "sp", [-1, 7, 4, 1]], ["tile_x", "sp", [-1, 1, 1, 1]], ["tile_rc", "sp", [-1, 2, 2]], ["tile_ry", "sp", [-1, 1, 3]], ["tile_rx", "sp", [-1, 1, 3]], ["auto_unroll_max_step", "ot", 0], ["unroll_explicit", "ot", 1]]}, "result": [[0.00019626499877750612], 0, 1.9627461433410645, 1700584830.4431036], "version": 0.2, "tvm_version": "0.15.dev0"}
{"input": ["cuda -keys=cuda,gpu -arch=sm_86 -max_num_threads=1024 -thread_warp_size=32", "tutorial/conv2d", [1, 28, 28, 128, 256, 3, 3, [1, 1], [1, 1]], {}], "config": {"index": 71267307, "code_hash": null, "entity": [["tile_f", "sp", [-1, 2, 16, 1]], ["tile_y", "sp", [-1, 4, 7, 1]], ["tile_x", "sp", [-1, 2, 2, 1]], ["tile_rc", "sp", [-1, 4, 2]], ["tile_ry", "sp", [-1, 1, 3]], ["tile_rx", "sp", [-1, 1, 3]], ["auto_unroll_max_step", "ot", 0], ["unroll_explicit", "ot", 0]]}, "result": [[0.00023892216344725112], 0, 2.2433431148529053, 1700584832.7263796], "version": 0.2, "tvm_version": "0.15.dev0"}
{"input": ["cuda -keys=cuda,gpu -arch=sm_86 -max_num_threads=1024 -thread_warp_size=32", "tutorial/conv2d", [1, 28, 28, 128, 256, 3, 3, [1, 1], [1, 1]], {}], "config": {"index": 458339298, "code_hash": null, "entity": [["tile_f", "sp", [-1, 8, 4, 1]], ["tile_y", "sp", [-1, 4, 7, 1]], ["tile_x", "sp", [-1, 2, 2, 1]], ["tile_rc", "sp", [-1, 4, 1]], ["tile_ry", "sp", [-1, 1, 3]], ["tile_rx", "sp", [-1, 1, 3]], ["auto_unroll_max_step", "ot", 1500], ["unroll_explicit", "ot", 1]]}, "result": [[0.00022438328491620113], 0, 3.1092031002044678, 1700584834.0651755], "version": 0.2, "tvm_version": "0.15.dev0"}
{"input": ["cuda -keys=cuda,gpu -arch=sm_86 -max_num_threads=1024 -thread_warp_size=32", "tutorial/conv2d", [1, 28, 28, 128, 256, 3, 3, [1, 1], [1, 1]], {}], "config": {"index": 17472618, "code_hash": null, "entity": [["tile_f", "sp", [-1, 8, 4, 1]], ["tile_y", "sp", [-1, 28, 1, 1]], ["tile_x", "sp", [-1, 1, 1, 1]], ["tile_rc", "sp", [-1, 2, 1]], ["tile_ry", "sp", [-1, 1, 3]], ["tile_rx", "sp", [-1, 1, 1]], ["auto_unroll_max_step", "ot", 0], ["unroll_explicit", "ot", 0]]}, "result": [[0.0015837731683168317], 0, 2.194939136505127, 1700584835.0481389], "version": 0.2, "tvm_version": "0.15.dev0"}
{"input": ["cuda -keys=cuda,gpu -arch=sm_86 -max_num_threads=1024 -thread_warp_size=32", "tutorial/conv2d", [1, 28, 28, 128, 256, 3, 3, [1, 1], [1, 1]], {}], "config": {"index": 77760618, "code_hash": null, "entity": [["tile_f", "sp", [-1, 8, 4, 1]], ["tile_y", "sp", [-1, 28, 1, 1]], ["tile_x", "sp", [-1, 1, 1, 1]], ["tile_rc", "sp", [-1, 1, 1]], ["tile_ry", "sp", [-1, 1, 1]], ["tile_rx", "sp", [-1, 1, 1]], ["auto_unroll_max_step", "ot", 512], ["unroll_explicit", "ot", 0]]}, "result": [[0.0011799352235294118], 0, 1.6690590381622314, 1700584835.7468538], "version": 0.2, "tvm_version": "0.15.dev0"}
{"input": ["cuda -keys=cuda,gpu -arch=sm_86 -max_num_threads=1024 -thread_warp_size=32", "tutorial/conv2d", [1, 28, 28, 128, 256, 3, 3, [1, 1], [1, 1]], {}], "config": {"index": 55302852, "code_hash": null, "entity": [["tile_f", "sp", [-1, 16, 2, 1]], ["tile_y", "sp", [-1, 1, 28, 1]], ["tile_x", "sp", [-1, 2, 1, 1]], ["tile_rc", "sp", [-1, 2, 4]], ["tile_ry", "sp", [-1, 1, 1]], ["tile_rx", "sp", [-1, 1, 3]], ["auto_unroll_max_step", "ot", 0], ["unroll_explicit", "ot", 0]]}, "result": [[0.0004402365613079019], 0, 2.0382840633392334, 1700584837.659879], "version": 0.2, "tvm_version": "0.15.dev0"}
{"input": ["cuda -keys=cuda,gpu -arch=sm_86 -max_num_threads=1024 -thread_warp_size=32", "tutorial/conv2d", [1, 28, 28, 128, 256, 3, 3, [1, 1], [1, 1]], {}], "config": {"index": 129792618, "code_hash": null, "entity": [["tile_f", "sp", [-1, 8, 4, 1]], ["tile_y", "sp", [-1, 28, 1, 1]], ["tile_x", "sp", [-1, 1, 1, 1]], ["tile_rc", "sp", [-1, 2, 1]], ["tile_ry", "sp", [-1, 1, 1]], ["tile_rx", "sp", [-1, 1, 3]], ["auto_unroll_max_step", "ot", 512], ["unroll_explicit", "ot", 0]]}, "result": [[0.0010424199895833332], 0, 1.84806489944458, 1700584838.3626077], "version": 0.2, "tvm_version": "0.15.dev0"}
{"input": ["cuda -keys=cuda,gpu -arch=sm_86 -max_num_threads=1024 -thread_warp_size=32", "tutorial/conv2d", [1, 28, 28, 128, 256, 3, 3, [1, 1], [1, 1]], {}], "config": {"index": 236929343, "code_hash": null, "entity": [["tile_f", "sp", [-1, 4, 8, 1]], ["tile_y", "sp", [-1, 7, 4, 1]], ["tile_x", "sp", [-1, 1, 1, 1]], ["tile_rc", "sp", [-1, 4, 4]], ["tile_ry", "sp", [-1, 1, 1]], ["tile_rx", "sp", [-1, 1, 1]], ["auto_unroll_max_step", "ot", 0], ["unroll_explicit", "ot", 1]]}, "result": [[0.0003005978228228228], 0, 1.9128968715667725, 1700584839.4211676], "version": 0.2, "tvm_version": "0.15.dev0"}
{"input": ["cuda -keys=cuda,gpu -arch=sm_86 -max_num_threads=1024 -thread_warp_size=32", "tutorial/conv2d", [1, 28, 28, 128, 256, 3, 3, [1, 1], [1, 1]], {}], "config": {"index": 77952618, "code_hash": null, "entity": [["tile_f", "sp", [-1, 8, 4, 1]], ["tile_y", "sp", [-1, 28, 1, 1]], ["tile_x", "sp", [-1, 1, 1, 1]], ["tile_rc", "sp", [-1, 2, 1]], ["tile_ry", "sp", [-1, 1, 1]], ["tile_rx", "sp", [-1, 1, 1]], ["auto_unroll_max_step", "ot", 512], ["unroll_explicit", "ot", 0]]}, "result": [[0.0015084891194029851], 0, 1.8891966342926025, 1700584841.0623882], "version": 0.2, "tvm_version": "0.15.dev0"}
{"input": ["cuda -keys=cuda,gpu -arch=sm_86 -max_num_threads=1024 -thread_warp_size=32", "tutorial/conv2d", [1, 28, 28, 128, 256, 3, 3, [1, 1], [1, 1]], {}], "config": {"index": 207553332, "code_hash": null, "entity": [["tile_f", "sp", [-1, 16, 2, 1]], ["tile_y", "sp", [-1, 7, 4, 1]], ["tile_x", "sp", [-1, 1, 1, 1]], ["tile_rc", "sp", [-1, 2, 1]], ["tile_ry", "sp", [-1, 1, 1]], ["tile_rx", "sp", [-1, 1, 3]], ["auto_unroll_max_step", "ot", 1500], ["unroll_explicit", "ot", 0]]}, "result": [[0.0005069701446540881], 0, 2.002884864807129, 1700584842.9813378], "version": 0.2, "tvm_version": "0.15.dev0"}
{"input": ["cuda -keys=cuda,gpu -arch=sm_86 -max_num_threads=1024 -thread_warp_size=32", "tutorial/conv2d", [1, 28, 28, 128, 256, 3, 3, [1, 1], [1, 1]], {}], "config": {"index": 233281103, "code_hash": null, "entity": [["tile_f", "sp", [-1, 4, 8, 1]], ["tile_y", "sp", [-1, 14, 2, 1]], ["tile_x", "sp", [-1, 1, 1, 1]], ["tile_rc", "sp", [-1, 1, 1]], ["tile_ry", "sp", [-1, 1, 1]], ["tile_rx", "sp", [-1, 1, 1]], ["auto_unroll_max_step", "ot", 0], ["unroll_explicit", "ot", 1]]}, "result": [[0.0006663532066115703], 0, 1.8383347988128662, 1700584844.169438], "version": 0.2, "tvm_version": "0.15.dev0"}
{"input": ["cuda -keys=cuda,gpu -arch=sm_86 -max_num_threads=1024 -thread_warp_size=32", "tutorial/conv2d", [1, 28, 28, 128, 256, 3, 3, [1, 1], [1, 1]], {}], "config": {"index": 155713332, "code_hash": null, "entity": [["tile_f", "sp", [-1, 16, 2, 1]], ["tile_y", "sp", [-1, 7, 4, 1]], ["tile_x", "sp", [-1, 1, 1, 1]], ["tile_rc", "sp", [-1, 2, 1]], ["tile_ry", "sp", [-1, 1, 1]], ["tile_rx", "sp", [-1, 1, 1]], ["auto_unroll_max_step", "ot", 1500], ["unroll_explicit", "ot", 0]]}, "result": [[0.0004890872363636364], 0, 2.0721216201782227, 1700584846.0864027], "version": 0.2, "tvm_version": "0.15.dev0"}
{"input": ["cuda -keys=cuda,gpu -arch=sm_86 -max_num_threads=1024 -thread_warp_size=32", "tutorial/conv2d", [1, 28, 28, 128, 256, 3, 3, [1, 1], [1, 1]], {}], "config": {"index": 406662852, "code_hash": null, "entity": [["tile_f", "sp", [-1, 16, 2, 1]], ["tile_y", "sp", [-1, 1, 28, 1]], ["tile_x", "sp", [-1, 2, 1, 1]], ["tile_rc", "sp", [-1, 8, 1]], ["tile_ry", "sp", [-1, 1, 3]], ["tile_rx", "sp", [-1, 1, 1]], ["auto_unroll_max_step", "ot", 1500], ["unroll_explicit", "ot", 1]]}, "result": [[0.00013239448967795208], 0, 3.0948922634124756, 1700584847.0602806], "version": 0.2, "tvm_version": "0.15.dev0"}
{"input": ["cuda -keys=cuda,gpu -arch=sm_86 -max_num_threads=1024 -thread_warp_size=32", "tutorial/conv2d", [1, 28, 28, 128, 256, 3, 3, [1, 1], [1, 1]], {}], "config": {"index": 251142852, "code_hash": null, "entity": [["tile_f", "sp", [-1, 16, 2, 1]], ["tile_y", "sp", [-1, 1, 28, 1]], ["tile_x", "sp", [-1, 2, 1, 1]], ["tile_rc", "sp", [-1, 8, 1]], ["tile_ry", "sp", [-1, 1, 3]], ["tile_rx", "sp", [-1, 1, 1]], ["auto_unroll_max_step", "ot", 0], ["unroll_explicit", "ot", 1]]}, "result": [[0.00046480443515850144], 0, 1.8182094097137451, 1700584848.354984], "version": 0.2, "tvm_version": "0.15.dev0"}
{"input": ["cuda -keys=cuda,gpu -arch=sm_86 -max_num_threads=1024 -thread_warp_size=32", "tutorial/conv2d", [1, 28, 28, 128, 256, 3, 3, [1, 1], [1, 1]], {}], "config": {"index": 155520618, "code_hash": null, "entity": [["tile_f", "sp", [-1, 8, 4, 1]], ["tile_y", "sp", [-1, 28, 1, 1]], ["tile_x", "sp", [-1, 1, 1, 1]], ["tile_rc", "sp", [-1, 1, 1]], ["tile_ry", "sp", [-1, 1, 1]], ["tile_rx", "sp", [-1, 1, 1]], ["auto_unroll_max_step", "ot", 1500], ["unroll_explicit", "ot", 0]]}, "result": [[0.0011803105882352942], 0, 2.1566121578216553, 1700584849.2611928], "version": 0.2, "tvm_version": "0.15.dev0"}
{"input": ["cuda -keys=cuda,gpu -arch=sm_86 -max_num_threads=1024 -thread_warp_size=32", "tutorial/conv2d", [1, 28, 28, 128, 256, 3, 3, [1, 1], [1, 1]], {}], "config": {"index": 311040612, "code_hash": null, "entity": [["tile_f", "sp", [-1, 16, 2, 1]], ["tile_y", "sp", [-1, 28, 1, 1]], ["tile_x", "sp", [-1, 1, 1, 1]], ["tile_rc", "sp", [-1, 1, 1]], ["tile_ry", "sp", [-1, 1, 1]], ["tile_rx", "sp", [-1, 1, 1]], ["auto_unroll_max_step", "ot", 512], ["unroll_explicit", "ot", 1]]}, "result": [[0.048477695249999994], 0, 3.543644428253174, 1700584850.284373], "version": 0.2, "tvm_version": "0.15.dev0"}
{"input": ["cuda -keys=cuda,gpu -arch=sm_86 -max_num_threads=1024 -thread_warp_size=32", "tutorial/conv2d", [1, 28, 28, 128, 256, 3, 3, [1, 1], [1, 1]], {}], "config": {"index": 233280618, "code_hash": null, "entity": [["tile_f", "sp", [-1, 8, 4, 1]], ["tile_y", "sp", [-1, 28, 1, 1]], ["tile_x", "sp", [-1, 1, 1, 1]], ["tile_rc", "sp", [-1, 1, 1]], ["tile_ry", "sp", [-1, 1, 1]], ["tile_rx", "sp", [-1, 1, 1]], ["auto_unroll_max_step", "ot", 0], ["unroll_explicit", "ot", 1]]}, "result": [[0.001179780482352941], 0, 1.7241888046264648, 1700584852.0766354], "version": 0.2, "tvm_version": "0.15.dev0"}
{"input": ["cuda -keys=cuda,gpu -arch=sm_86 -max_num_threads=1024 -thread_warp_size=32", "tutorial/conv2d", [1, 28, 28, 128, 256, 3, 3, [1, 1], [1, 1]], {}], "config": {"index": 363072618, "code_hash": null, "entity": [["tile_f", "sp", [-1, 8, 4, 1]], ["tile_y", "sp", [-1, 28, 1, 1]], ["tile_x", "sp", [-1, 1, 1, 1]], ["tile_rc", "sp", [-1, 2, 1]], ["tile_ry", "sp", [-1, 1, 1]], ["tile_rx", "sp", [-1, 1, 3]], ["auto_unroll_max_step", "ot", 512], ["unroll_explicit", "ot", 1]]}, "result": [[0.00062716760625], 0, 2.4635090827941895, 1700584852.7733681], "version": 0.2, "tvm_version": "0.15.dev0"}
{"input": ["cuda -keys=cuda,gpu -arch=sm_86 -max_num_threads=1024 -thread_warp_size=32", "tutorial/conv2d", [1, 28, 28, 128, 256, 3, 3, [1, 1], [1, 1]], {}], "config": {"index": 311041092, "code_hash": null, "entity": [["tile_f", "sp", [-1, 16, 2, 1]], ["tile_y", "sp", [-1, 14, 2, 1]], ["tile_x", "sp", [-1, 1, 1, 1]], ["tile_rc", "sp", [-1, 1, 1]], ["tile_ry", "sp", [-1, 1, 1]], ["tile_rx", "sp", [-1, 1, 1]], ["auto_unroll_max_step", "ot", 512], ["unroll_explicit", "ot", 1]]}, "result": [[0.001426273394366197], 0, 2.1039958000183105, 1700584853.6811652], "version": 0.2, "tvm_version": "0.15.dev0"}
{"input": ["cuda -keys=cuda,gpu -arch=sm_86 -max_num_threads=1024 -thread_warp_size=32", "tutorial/conv2d", [1, 28, 28, 128, 256, 3, 3, [1, 1], [1, 1]], {}], "config": {"index": 233281343, "code_hash": null, "entity": [["tile_f", "sp", [-1, 4, 8, 1]], ["tile_y", "sp", [-1, 7, 4, 1]], ["tile_x", "sp", [-1, 1, 1, 1]], ["tile_rc", "sp", [-1, 1, 1]], ["tile_ry", "sp", [-1, 1, 1]], ["tile_rx", "sp", [-1, 1, 1]], ["auto_unroll_max_step", "ot", 0], ["unroll_explicit", "ot", 1]]}, "result": [[0.0005886373588235295], 0, 1.4449284076690674, 1700584854.3743212], "version": 0.2, "tvm_version": "0.15.dev0"}
{"input": ["cuda -keys=cuda,gpu -arch=sm_86 -max_num_threads=1024 -thread_warp_size=32", "tutorial/conv2d", [1, 28, 28, 128, 256, 3, 3, [1, 1], [1, 1]], {}], "config": {"index": 254022852, "code_hash": null, "entity": [["tile_f", "sp", [-1, 16, 2, 1]], ["tile_y", "sp", [-1, 1, 28, 1]], ["tile_x", "sp", [-1, 2, 1, 1]], ["tile_rc", "sp", [-1, 2, 4]], ["tile_ry", "sp", [-1, 1, 3]], ["tile_rx", "sp", [-1, 1, 1]], ["auto_unroll_max_step", "ot", 0], ["unroll_explicit", "ot", 1]]}, "result": [[0.0004400772370572207], 0, 2.2494704723358154, 1700584856.5278168], "version": 0.2, "tvm_version": "0.15.dev0"}
{"input": ["cuda -keys=cuda,gpu -arch=sm_86 -max_num_threads=1024 -thread_warp_size=32", "tutorial/conv2d", [1, 28, 28, 128, 256, 3, 3, [1, 1], [1, 1]], {}], "config": {"index": 441030498, "code_hash": null, "entity": [["tile_f", "sp", [-1, 8, 4, 1]], ["tile_y", "sp", [-1, 4, 7, 1]], ["tile_x", "sp", [-1, 2, 1, 1]], ["tile_rc", "sp", [-1, 4, 1]], ["tile_ry", "sp", [-1, 1, 1]], ["tile_rx", "sp", [-1, 1, 3]], ["auto_unroll_max_step", "ot", 1500], ["unroll_explicit", "ot", 1]]}, "result": [[0.00029041633273381293], 0, 2.6836111545562744, 1700584857.504836], "version": 0.2, "tvm_version": "0.15.dev0"}
{"input": ["cuda -keys=cuda,gpu -arch=sm_86 -max_num_threads=1024 -thread_warp_size=32", "tutorial/conv2d", [1, 28, 28, 128, 256, 3, 3, [1, 1], [1, 1]], {}], "config": {"index": 331782852, "code_hash": null, "entity": [["tile_f", "sp", [-1, 16, 2, 1]], ["tile_y", "sp", [-1, 1, 28, 1]], ["tile_x", "sp", [-1, 2, 1, 1]], ["tile_rc", "sp", [-1, 2, 4]], ["tile_ry", "sp", [-1, 1, 3]], ["tile_rx", "sp", [-1, 1, 1]], ["auto_unroll_max_step", "ot", 512], ["unroll_explicit", "ot", 1]]}, "result": [[0.0001530046974310181], 0, 2.074439764022827, 1700584859.3807416], "version": 0.2, "tvm_version": "0.15.dev0"}
{"input": ["cuda -keys=cuda,gpu -arch=sm_86 -max_num_threads=1024 -thread_warp_size=32", "tutorial/conv2d", [1, 28, 28, 128, 256, 3, 3, [1, 1], [1, 1]], {}], "config": {"index": 388800618, "code_hash": null, "entity": [["tile_f", "sp", [-1, 8, 4, 1]], ["tile_y", "sp", [-1, 28, 1, 1]], ["tile_x", "sp", [-1, 1, 1, 1]], ["tile_rc", "sp", [-1, 1, 1]], ["tile_ry", "sp", [-1, 1, 1]], ["tile_rx", "sp", [-1, 1, 1]], ["auto_unroll_max_step", "ot", 1500], ["unroll_explicit", "ot", 1]]}, "result": [[0.0009676405769230769], 0, 2.734440326690674, 1700584860.456061], "version": 0.2, "tvm_version": "0.15.dev0"}
{"input": ["cuda -keys=cuda,gpu -arch=sm_86 -max_num_threads=1024 -thread_warp_size=32", "tutorial/conv2d", [1, 28, 28, 128, 256, 3, 3, [1, 1], [1, 1]], {}], "config": {"index": 363073338, "code_hash": null, "entity": [["tile_f", "sp", [-1, 8, 4, 1]], ["tile_y", "sp", [-1, 7, 4, 1]], ["tile_x", "sp", [-1, 1, 1, 1]], ["tile_rc", "sp", [-1, 2, 1]], ["tile_ry", "sp", [-1, 1, 1]], ["tile_rx", "sp", [-1, 1, 3]], ["auto_unroll_max_step", "ot", 512], ["unroll_explicit", "ot", 1]]}, "result": [[0.00032116344135188864], 0, 2.087859630584717, 1700584861.4529073], "version": 0.2, "tvm_version": "0.15.dev0"}
{"input": ["cuda -keys=cuda,gpu -arch=sm_86 -max_num_threads=1024 -thread_warp_size=32", "tutorial/conv2d", [1, 28, 28, 128, 256, 3, 3, [1, 1], [1, 1]], {}], "config": {"index": 432126733, "code_hash": null, "entity": [["tile_f", "sp", [-1, 32, 2, 1]], ["tile_y", "sp", [-1, 2, 14, 1]], ["tile_x", "sp", [-1, 1, 14, 2]], ["tile_rc", "sp", [-1, 1, 1]], ["tile_ry", "sp", [-1, 1, 3]], ["tile_rx", "sp", [-1, 3, 1]], ["auto_unroll_max_step", "ot", 1500], ["unroll_explicit", "ot", 1]]}, "result": [[0.010323661], 0, 3.5353145599365234, 1700584977.734657], "version": 0.2, "tvm_version": "0.15.dev0"}
{"input": ["cuda -keys=cuda,gpu -arch=sm_86 -max_num_threads=1024 -thread_warp_size=32", "tutorial/conv2d", [1, 28, 28, 128, 256, 3, 3, [1, 1], [1, 1]], {}], "config": {"index": 198846733, "code_hash": null, "entity": [["tile_f", "sp", [-1, 32, 2, 1]], ["tile_y", "sp", [-1, 2, 14, 1]], ["tile_x", "sp", [-1, 1, 14, 2]], ["tile_rc", "sp", [-1, 1, 1]], ["tile_ry", "sp", [-1, 1, 3]], ["tile_rx", "sp", [-1, 3, 1]], ["auto_unroll_max_step", "ot", 1500], ["unroll_explicit", "ot", 0]]}, "result": [[0.010413362800000001], 0, 2.003826379776001, 1700584978.5163853], "version": 0.2, "tvm_version": "0.15.dev0"}
{"input": ["cuda -keys=cuda,gpu -arch=sm_86 -max_num_threads=1024 -thread_warp_size=32", "tutorial/conv2d", [1, 28, 28, 128, 256, 3, 3, [1, 1], [1, 1]], {}], "config": {"index": 216016339, "code_hash": null, "entity": [["tile_f", "sp", [-1, 16, 4, 1]], ["tile_y", "sp", [-1, 2, 14, 1]], ["tile_x", "sp", [-1, 7, 1, 1]], ["tile_rc", "sp", [-1, 1, 1]], ["tile_ry", "sp", [-1, 3, 1]], ["tile_rx", "sp", [-1, 1, 3]], ["auto_unroll_max_step", "ot", 1500], ["unroll_explicit", "ot", 0]]}, "result": [[0.0012909464615384616], 0, 1.9084649085998535, 1700584979.22773], "version": 0.2, "tvm_version": "0.15.dev0"}
{"input": ["cuda -keys=cuda,gpu -arch=sm_86 -max_num_threads=1024 -thread_warp_size=32", "tutorial/conv2d", [1, 28, 28, 128, 256, 3, 3, [1, 1], [1, 1]], {}], "config": {"index": 406081933, "code_hash": null, "entity": [["tile_f", "sp", [-1, 32, 2, 1]], ["tile_y", "sp", [-1, 2, 14, 1]], ["tile_x", "sp", [-1, 1, 1, 1]], ["tile_rc", "sp", [-1, 1, 1]], ["tile_ry", "sp", [-1, 1, 3]], ["tile_rx", "sp", [-1, 1, 1]], ["auto_unroll_max_step", "ot", 1500], ["unroll_explicit", "ot", 1]]}, "result": [[0.000350672037037037], 0, 2.4578330516815186, 1700584980.2155275], "version": 0.2, "tvm_version": "0.15.dev0"}
{"input": ["cuda -keys=cuda,gpu -arch=sm_86 -max_num_threads=1024 -thread_warp_size=32", "tutorial/conv2d", [1, 28, 28, 128, 256, 3, 3, [1, 1], [1, 1]], {}], "config": {"index": 390587524, "code_hash": null, "entity": [["tile_f", "sp", [-1, 16, 1, 1]], ["tile_y", "sp", [-1, 2, 14, 1]], ["tile_x", "sp", [-1, 1, 7, 1]], ["tile_rc", "sp", [-1, 1, 2]], ["tile_ry", "sp", [-1, 1, 1]], ["tile_rx", "sp", [-1, 1, 1]], ["auto_unroll_max_step", "ot", 1500], ["unroll_explicit", "ot", 1]]}, "result": [[0.00026296753017944534], 0, 2.7044429779052734, 1700584981.3729165], "version": 0.2, "tvm_version": "0.15.dev0"}
{"input": ["cuda -keys=cuda,gpu -arch=sm_86 -max_num_threads=1024 -thread_warp_size=32", "tutorial/conv2d", [1, 28, 28, 128, 256, 3, 3, [1, 1], [1, 1]], {}], "config": {"index": 347526743, "code_hash": null, "entity": [["tile_f", "sp", [-1, 4, 8, 1]], ["tile_y", "sp", [-1, 2, 14, 1]], ["tile_x", "sp", [-1, 2, 1, 1]], ["tile_rc", "sp", [-1, 2, 2]], ["tile_ry", "sp", [-1, 3, 1]], ["tile_rx", "sp", [-1, 3, 1]], ["auto_unroll_max_step", "ot", 512], ["unroll_explicit", "ot", 1]]}, "result": [[0.00010684940520694258], 0, 2.0377790927886963, 1700584982.335992], "version": 0.2, "tvm_version": "0.15.dev0"}
{"input": ["cuda -keys=cuda,gpu -arch=sm_86 -max_num_threads=1024 -thread_warp_size=32", "tutorial/conv2d", [1, 28, 28, 128, 256, 3, 3, [1, 1], [1, 1]], {}], "config": {"index": 164176339, "code_hash": null, "entity": [["tile_f", "sp", [-1, 16, 4, 1]], ["tile_y", "sp", [-1, 2, 14, 1]], ["tile_x", "sp", [-1, 7, 1, 1]], ["tile_rc", "sp", [-1, 1, 1]], ["tile_ry", "sp", [-1, 3, 1]], ["tile_rx", "sp", [-1, 1, 1]], ["auto_unroll_max_step", "ot", 1500], ["unroll_explicit", "ot", 0]]}, "result": [[0.0013910897500000001], 0, 2.1331775188446045, 1700584983.0347283], "version": 0.2, "tvm_version": "0.15.dev0"}
{"input": ["cuda -keys=cuda,gpu -arch=sm_86 -max_num_threads=1024 -thread_warp_size=32", "tutorial/conv2d", [1, 28, 28, 128, 256, 3, 3, [1, 1], [1, 1]], {}], "config": {"index": 190096339, "code_hash": null, "entity": [["tile_f", "sp", [-1, 16, 4, 1]], ["tile_y", "sp", [-1, 2, 14, 1]], ["tile_x", "sp", [-1, 7, 1, 1]], ["tile_rc", "sp", [-1, 1, 1]], ["tile_ry", "sp", [-1, 3, 1]], ["tile_rx", "sp", [-1, 3, 1]], ["auto_unroll_max_step", "ot", 1500], ["unroll_explicit", "ot", 0]]}, "result": [[0.0010908048804347827], 0, 1.9727857112884521, 1700584983.916465], "version": 0.2, "tvm_version": "0.15.dev0"}
{"input": ["cuda -keys=cuda,gpu -arch=sm_86 -max_num_threads=1024 -thread_warp_size=32", "tutorial/conv2d", [1, 28, 28, 128, 256, 3, 3, [1, 1], [1, 1]], {}], "config": {"index": 157312324, "code_hash": null, "entity": [["tile_f", "sp", [-1, 16, 1, 1]], ["tile_y", "sp", [-1, 2, 14, 1]], ["tile_x", "sp", [-1, 2, 7, 1]], ["tile_rc", "sp", [-1, 1, 2]], ["tile_ry", "sp", [-1, 1, 1]], ["tile_rx", "sp", [-1, 1, 1]], ["auto_unroll_max_step", "ot", 1500], ["unroll_explicit", "ot", 0]]}, "result": [[0.000439614068119891], 0, 2.077908992767334, 1700584984.9175112], "version": 0.2, "tvm_version": "0.15.dev0"}
{"input": ["cuda -keys=cuda,gpu -arch=sm_86 -max_num_threads=1024 -thread_warp_size=32", "tutorial/conv2d", [1, 28, 28, 128, 256, 3, 3, [1, 1], [1, 1]], {}], "config": {"index": 381987032, "code_hash": null, "entity": [["tile_f", "sp", [-1, 4, 32, 1]], ["tile_y", "sp", [-1, 2, 7, 2]], ["tile_x", "sp", [-1, 7, 1, 2]], ["tile_rc", "sp", [-1, 1, 2]], ["tile_ry", "sp", [-1, 1, 3]], ["tile_rx", "sp", [-1, 1, 3]], ["auto_unroll_max_step", "ot", 512], ["unroll_explicit", "ot", 1]]}, "result": [[0.003109205303030303], 0, 3.2928683757781982, 1700584985.63292], "version": 0.2, "tvm_version": "0.15.dev0"}
{"input": ["cuda -keys=cuda,gpu -arch=sm_86 -max_num_threads=1024 -thread_warp_size=32", "tutorial/conv2d", [1, 28, 28, 128, 256, 3, 3, [1, 1], [1, 1]], {}], "config": {"index": 388889414, "code_hash": null, "entity": [["tile_f", "sp", [-1, 64, 2, 1]], ["tile_y", "sp", [-1, 2, 7, 2]], ["tile_x", "sp", [-1, 1, 1, 2]], ["tile_rc", "sp", [-1, 1, 1]], ["tile_ry", "sp", [-1, 1, 1]], ["tile_rx", "sp", [-1, 1, 1]], ["auto_unroll_max_step", "ot", 1500], ["unroll_explicit", "ot", 1]]}, "result": [[0.011915939222222222], 0, 4.295509099960327, 1700584986.7453973], "version": 0.2, "tvm_version": "0.15.dev0"}
{"input": ["cuda -keys=cuda,gpu -arch=sm_86 -max_num_threads=1024 -thread_warp_size=32", "tutorial/conv2d", [1, 28, 28, 128, 256, 3, 3, [1, 1], [1, 1]], {}], "config": {"index": 224718613, "code_hash": null, "entity": [["tile_f", "sp", [-1, 32, 2, 1]], ["tile_y", "sp", [-1, 1, 14, 1]], ["tile_x", "sp", [-1, 2, 14, 1]], ["tile_rc", "sp", [-1, 1, 1]], ["tile_ry", "sp", [-1, 1, 3]], ["tile_rx", "sp", [-1, 1, 3]], ["auto_unroll_max_step", "ot", 1500], ["unroll_explicit", "ot", 0]]}, "result": [[0.0012272140609756097], 0, 1.6968410015106201, 1700584987.4578831], "version": 0.2, "tvm_version": "0.15.dev0"}
{"input": ["cuda -keys=cuda,gpu -arch=sm_86 -max_num_threads=1024 -thread_warp_size=32", "tutorial/conv2d", [1, 28, 28, 128, 256, 3, 3, [1, 1], [1, 1]], {}], "config": {"index": 312799814, "code_hash": null, "entity": [["tile_f", "sp", [-1, 64, 2, 1]], ["tile_y", "sp", [-1, 2, 7, 2]], ["tile_x", "sp", [-1, 1, 2, 1]], ["tile_rc", "sp", [-1, 1, 2]], ["tile_ry", "sp", [-1, 1, 1]], ["tile_rx", "sp", [-1, 1, 1]], ["auto_unroll_max_step", "ot", 512], ["unroll_explicit", "ot", 1]]}, "result": [[0.0017346559655172413], 0, 2.770942449569702, 1700584988.357543], "version": 0.2, "tvm_version": "0.15.dev0"}
{"input": ["cuda -keys=cuda,gpu -arch=sm_86 -max_num_threads=1024 -thread_warp_size=32", "tutorial/conv2d", [1, 28, 28, 128, 256, 3, 3, [1, 1], [1, 1]], {}], "config": {"index": 313019525, "code_hash": null, "entity": [["tile_f", "sp", [-1, 32, 1, 1]], ["tile_y", "sp", [-1, 2, 14, 1]], ["tile_x", "sp", [-1, 1, 7, 1]], ["tile_rc", "sp", [-1, 2, 2]], ["tile_ry", "sp", [-1, 1, 1]], ["tile_rx", "sp", [-1, 1, 1]], ["auto_unroll_max_step", "ot", 512], ["unroll_explicit", "ot", 1]]}, "result": [[0.00048576869417475736], 0, 2.0179240703582764, 1700584989.0756986], "version": 0.2, "tvm_version": "0.15.dev0"}
{"input": ["cuda -keys=cuda,gpu -arch=sm_86 -max_num_threads=1024 -thread_warp_size=32", "tutorial/conv2d", [1, 28, 28, 128, 256, 3, 3, [1, 1], [1, 1]], {}], "config": {"index": 397486234, "code_hash": null, "entity": [["tile_f", "sp", [-1, 2, 64, 1]], ["tile_y", "sp", [-1, 2, 7, 2]], ["tile_x", "sp", [-1, 14, 2, 1]], ["tile_rc", "sp", [-1, 1, 1]], ["tile_ry", "sp", [-1, 3, 1]], ["tile_rx", "sp", [-1, 1, 1]], ["auto_unroll_max_step", "ot", 1500], ["unroll_explicit", "ot", 1]]}, "result": [[0.021581136], 0, 2.184732675552368, 1700584989.985399], "version": 0.2, "tvm_version": "0.15.dev0"}
{"input": ["cuda -keys=cuda,gpu -arch=sm_86 -max_num_threads=1024 -thread_warp_size=32", "tutorial/conv2d", [1, 28, 28, 128, 256, 3, 3, [1, 1], [1, 1]], {}], "config": {"index": 190096354, "code_hash": null, "entity": [["tile_f", "sp", [-1, 2, 64, 1]], ["tile_y", "sp", [-1, 2, 14, 1]], ["tile_x", "sp", [-1, 7, 1, 1]], ["tile_rc", "sp", [-1, 1, 1]], ["tile_ry", "sp", [-1, 3, 1]], ["tile_rx", "sp", [-1, 3, 1]], ["auto_unroll_max_step", "ot", 1500], ["unroll_explicit", "ot", 0]]}, "result": [[0.0007210138417266187], 0, 1.460827350616455, 1700584990.9485214], "version": 0.2, "tvm_version": "0.15.dev0"}
{"input": ["cuda -keys=cuda,gpu -arch=sm_86 -max_num_threads=1024 -thread_warp_size=32", "tutorial/conv2d", [1, 28, 28, 128, 256, 3, 3, [1, 1], [1, 1]], {}], "config": {"index": 224718608, "code_hash": null, "entity": [["tile_f", "sp", [-1, 1, 2, 1]], ["tile_y", "sp", [-1, 1, 14, 1]], ["tile_x", "sp", [-1, 2, 14, 1]], ["tile_rc", "sp", [-1, 1, 1]], ["tile_ry", "sp", [-1, 1, 3]], ["tile_rx", "sp", [-1, 1, 3]], ["auto_unroll_max_step", "ot", 1500], ["unroll_explicit", "ot", 0]]}, "result": [[0.00026837631166666667], 0, 1.505500316619873, 1700584991.9192233], "version": 0.2, "tvm_version": "0.15.dev0"}
{"input": ["cuda -keys=cuda,gpu -arch=sm_86 -max_num_threads=1024 -thread_warp_size=32", "tutorial/conv2d", [1, 28, 28, 128, 256, 3, 3, [1, 1], [1, 1]], {}], "config": {"index": 373461147, "code_hash": null, "entity": [["tile_f", "sp", [-1, 2, 16, 1]], ["tile_y", "sp", [-1, 2, 14, 1]], ["tile_x", "sp", [-1, 14, 1, 1]], ["tile_rc", "sp", [-1, 2, 2]], ["tile_ry", "sp", [-1, 3, 1]], ["tile_rx", "sp", [-1, 1, 3]], ["auto_unroll_max_step", "ot", 512], ["unroll_explicit", "ot", 1]]}, "result": [[0.00045459084545454545], 0, 2.3292267322540283, 1700584992.5990279], "version": 0.2, "tvm_version": "0.15.dev0"}
{"input": ["cuda -keys=cuda,gpu -arch=sm_86 -max_num_threads=1024 -thread_warp_size=32", "tutorial/conv2d", [1, 28, 28, 128, 256, 3, 3, [1, 1], [1, 1]], {}], "config": {"index": 226590625, "code_hash": null, "entity": [["tile_f", "sp", [-1, 16, 8, 1]], ["tile_y", "sp", [-1, 1, 14, 1]], ["tile_x", "sp", [-1, 1, 2, 1]], ["tile_rc", "sp", [-1, 2, 2]], ["tile_ry", "sp", [-1, 1, 3]], ["tile_rx", "sp", [-1, 1, 3]], ["auto_unroll_max_step", "ot", 1500], ["unroll_explicit", "ot", 0]]}, "result": [[0.0002598156763285024], 0, 2.5056982040405273, 1700584993.5953865], "version": 0.2, "tvm_version": "0.15.dev0"}
{"input": ["cuda -keys=cuda,gpu -arch=sm_86 -max_num_threads=1024 -thread_warp_size=32", "tutorial/conv2d", [1, 28, 28, 128, 256, 3, 3, [1, 1], [1, 1]], {}], "config": {"index": 330078612, "code_hash": null, "entity": [["tile_f", "sp", [-1, 16, 2, 1]], ["tile_y", "sp", [-1, 1, 14, 1]], ["tile_x", "sp", [-1, 1, 2, 1]], ["tile_rc", "sp", [-1, 1, 2]], ["tile_ry", "sp", [-1, 1, 3]], ["tile_rx", "sp", [-1, 1, 1]], ["auto_unroll_max_step", "ot", 512], ["unroll_explicit", "ot", 1]]}, "result": [[0.00017230601918976545], 0, 1.8129615783691406, 1700584994.555664], "version": 0.2, "tvm_version": "0.15.dev0"}
{"input": ["cuda -keys=cuda,gpu -arch=sm_86 -max_num_threads=1024 -thread_warp_size=32", "tutorial/conv2d", [1, 28, 28, 128, 256, 3, 3, [1, 1], [1, 1]], {}], "config": {"index": 423406234, "code_hash": null, "entity": [["tile_f", "sp", [-1, 2, 64, 1]], ["tile_y", "sp", [-1, 2, 7, 2]], ["tile_x", "sp", [-1, 14, 2, 1]], ["tile_rc", "sp", [-1, 1, 1]], ["tile_ry", "sp", [-1, 3, 1]], ["tile_rx", "sp", [-1, 3, 1]], ["auto_unroll_max_step", "ot", 1500], ["unroll_explicit", "ot", 1]]}, "result": [[0.014213503749999998], 0, 2.0550029277801514, 1700584995.435766], "version": 0.2, "tvm_version": "0.15.dev0"}
{"input": ["cuda -keys=cuda,gpu -arch=sm_86 -max_num_threads=1024 -thread_warp_size=32", "tutorial/conv2d", [1, 28, 28, 128, 256, 3, 3, [1, 1], [1, 1]], {}], "config": {"index": 390529947, "code_hash": null, "entity": [["tile_f", "sp", [-1, 2, 16, 1]], ["tile_y", "sp", [-1, 2, 14, 1]], ["tile_x", "sp", [-1, 1, 1, 1]], ["tile_rc", "sp", [-1, 1, 2]], ["tile_ry", "sp", [-1, 1, 1]], ["tile_rx", "sp", [-1, 1, 1]], ["auto_unroll_max_step", "ot", 1500], ["unroll_explicit", "ot", 1]]}, "result": [[0.00032219210179640714], 0, 1.588472604751587, 1700584996.4115708], "version": 0.2, "tvm_version": "0.15.dev0"}
{"input": ["cuda -keys=cuda,gpu -arch=sm_86 -max_num_threads=1024 -thread_warp_size=32", "tutorial/conv2d", [1, 28, 28, 128, 256, 3, 3, [1, 1], [1, 1]], {}], "config": {"index": 321621147, "code_hash": null, "entity": [["tile_f", "sp", [-1, 2, 16, 1]], ["tile_y", "sp", [-1, 2, 14, 1]], ["tile_x", "sp", [-1, 14, 1, 1]], ["tile_rc", "sp", [-1, 2, 2]], ["tile_ry", "sp", [-1, 3, 1]], ["tile_rx", "sp", [-1, 1, 1]], ["auto_unroll_max_step", "ot", 512], ["unroll_explicit", "ot", 1]]}, "result": [[0.0004988908792569659], 0, 1.890044927597046, 1700584997.391894], "version": 0.2, "tvm_version": "0.15.dev0"}
{"input": ["cuda -keys=cuda,gpu -arch=sm_86 -max_num_threads=1024 -thread_warp_size=32", "tutorial/conv2d", [1, 28, 28, 128, 256, 3, 3, [1, 1], [1, 1]], {}], "config": {"index": 226561825, "code_hash": null, "entity": [["tile_f", "sp", [-1, 16, 8, 1]], ["tile_y", "sp", [-1, 1, 14, 1]], ["tile_x", "sp", [-1, 1, 1, 1]], ["tile_rc", "sp", [-1, 2, 2]], ["tile_ry", "sp", [-1, 1, 3]], ["tile_rx", "sp", [-1, 1, 3]], ["auto_unroll_max_step", "ot", 1500], ["unroll_explicit", "ot", 0]]}, "result": [[0.0002052221119592875], 0, 2.363281488418579, 1700584998.4153843], "version": 0.2, "tvm_version": "0.15.dev0"}
{"input": ["cuda -keys=cuda,gpu -arch=sm_86 -max_num_threads=1024 -thread_warp_size=32", "tutorial/conv2d", [1, 28, 28, 128, 256, 3, 3, [1, 1], [1, 1]], {}], "config": {"index": 312852614, "code_hash": null, "entity": [["tile_f", "sp", [-1, 64, 2, 1]], ["tile_y", "sp", [-1, 2, 7, 2]], ["tile_x", "sp", [-1, 1, 28, 1]], ["tile_rc", "sp", [-1, 1, 2]], ["tile_ry", "sp", [-1, 1, 1]], ["tile_rx", "sp", [-1, 1, 1]], ["auto_unroll_max_step", "ot", 512], ["unroll_explicit", "ot", 1]]}, "result": [[0.018116096333333335], 0, 2.9116554260253906, 1700584999.4757466], "version": 0.2, "tvm_version": "0.15.dev0"}
